{
  "contract_version": "1.0",
  "project_id": "PROJECT-ID-FROM-report_confirmation.json",
  "decision": "confirmed",
  "confirmed_by": "user",
  "note": "确认并修正关键事实后继续编制。",
  "changes": {
    "recommended_scheme": {
      "name": "用户确认后的方案名称",
      "description": "用户确认后的方案描述"
    },
    "economic_summary": {
      "total_investment": {"value": null},
      "average_annual_profit": {"value": null},
      "static_payback_period": {"value": null},
      "after_tax_irr": {"value": null}
    },
    "equipment_summary": [
      {
        "equipment_id": "17",
        "retrofit_status": "利旧改造",
        "retrofit_description": "利旧现有设备形成新增工艺单元"
      }
    ]
  }
}
